{"ArtifactKind":"root-claims","HomeAuthorityKey":"51def52dac407f5d051fda57a2162fb4222c17a963697e0b04bae09191fbbee7","HomeRootLocationKey":"c:/fixture/profile","LiveRootClaims":[{"DeepestExistingParentIdentity":"a1b2c3d4:0000000000000001","DeepestExistingParentPath":"C:\\fixture\\profile","ExpectedPostState":"EXISTS","InitialDirectoryIdentity":null,"InitialState":"ABSENT","LocationKey":"c:/fixture/profile/.claude/skills","MissingRemainder":[".claude","skills"],"Platform":"Claude","RequestedPath":"C:\\fixture\\profile\\.claude\\skills","VolumeId":"a1b2c3d4"},{"DeepestExistingParentIdentity":"a1b2c3d4:0000000000000002","DeepestExistingParentPath":"C:\\fixture\\profile\\.codex\\skills","ExpectedPostState":"EXISTS","InitialDirectoryIdentity":"a1b2c3d4:0000000000000002","InitialState":"EXISTS","LocationKey":"c:/fixture/profile/.codex/skills","MissingRemainder":[],"Platform":"Codex","RequestedPath":"C:\\fixture\\profile\\.codex\\skills","VolumeId":"a1b2c3d4"},{"DeepestExistingParentIdentity":"a1b2c3d4:0000000000000003","DeepestExistingParentPath":"C:\\fixture\\roaming","ExpectedPostState":"EXISTS","InitialDirectoryIdentity":null,"InitialState":"ABSENT","LocationKey":"c:/fixture/roaming/reasonix/skills","MissingRemainder":["reasonix","skills"],"Platform":"Reasonix","RequestedPath":"C:\\fixture\\roaming\\reasonix\\skills","VolumeId":"a1b2c3d4"}],"ResolverVersion":"windows-token-sid-known-folder-v1","SchemaVersion":1,"TokenSid":"S-1-5-21-1000"}
